{
  "processingResult": {
    "success": true,
    "method": "pdf-parse-safe",
    "text": "\n\neuioaeuioa\nValuation\nasof 31.03.2025\nSwift CBLUCH2280A// Clearing 8490 // CHE-105.962.409IVA\nTel. +41 44 21810 20// Fax +41442181029// info@corner.ch // corner.ch\nCornèr Banca SA\n// Töd  istrasse 27 // Postfach 16  40 // 8027Zürich_Switzerland // Hauptsitz Via Canova 16,6901 Lugano_Switzerland\nMESSOS ENTERPRISES LTD.\n366223\nClient Number //\nUSD\nValuation currency //\nUndefined\nInvestment profile //\nMedium-high\nRisk Profile //\n\nIndex\nMESSOS ENTERPRISES LTD.\nValuation as of 31.03.2025\nClient Number 366223\naeouiAEOUIaeouiAEOUI\nPrint date 01.04.2025 // Page I\nSwift CBLUCH2280A// Clearing 8490 // CHE-105.962.409IVA\nTel. +41 44 21810 20// Fax +41442181029// info@corner.ch // corner.ch\nCornèr Banca SA\n// Töd  istrasse 27 // Postfach 16  40 // 8027Zürich_Switzerland // Hauptsitz Via Canova 16,6901 Lugano_Switzerland\n1Summary\n2Asset Allocation\n2Assets and Liabilities Structure\n3Currency allocation\n4Performance Overview/Evolution\n5Asset Listing\n5Liquidity and liabilities\n6Bonds\n10Equities\n11Structured products\n13Other assets\n14Expected Cash Flows (Overview)\n15Glossary\n17Notices and other information\n\nSummary\nMESSOS ENTERPRISES LTD.\nValuation as of 31.03.2025\nClient Number 366223\naeouiAEOUIaeouiAEOUI\nSwift CBLUCH2280A// Clearing 8490 // CHE-105.962.409IVA\nTel. +41 44 21810 20// Fax +41442181029// info@corner.ch // corner.ch\nCornèr Banca SA\n// Töd  istrasse 27 // Postfach 16  40 // 8027Zürich_Switzerland // Hauptsitz Via Canova 16,6901 Lugano_Switzerland\nNote // Blocked guarantees\nOther assets\nStructured products\nEquities\nLiquidity\nBonds\nAssets\nCHF\nUSD\nCurrencies\nAssetsCountervalue USDWeight in %\nLiquidity103'7700.53%\nBonds12'363'97463.52%\nEquities24'3190.12%\nMixed funds\nStructured products6'946'23935.69%\nPrecious metals\nReal Estate\nOther assets26'1290.13%\nTotal19'464'431100.00%\nThereof accrued interest345'057\nIncomeCountervalue USD\nCollected84'967\nAccruals345'057\nCurrenciesValueExchange RatesCountervalue USDWeight in %\nUSD19'440'11299.88%\nCHF21'4961.13130.883924'3190.12%\nTotal19'464'431100.00%\nPrint date 01.04.2025 // Page 1/17\n\nAssets and Liabilities Structure\nMESSOS ENTERPRISES LTD.\nValuation as of 31.03.2025\nClient Number 366223\naeouiAEOUIaeouiAEOUI\nSwift CBLUCH2280A// Clearing 8490 // CHE-105.962.409IVA\nTel. +41 44 21810 20// Fax +41442181029// info@corner.ch // corner.ch\nCornèr Banca SA\n// Töd  istrasse 27 // Postfach 16  40 // 8027Zürich_Switzerland // Hauptsitz Via Canova 16,6901 Lugano_Switzerland\nAsset AllocationCountervalue USDWeight\nLiquidity103'7700.53%\nCash accounts6'0700.03%\nMoney Market97'7000.50%\nFixed deposits and fiduciaries\nBonds12'363'97463.52%\nBonds11'002'50856.53%\nBond funds / certificat  es1'  361'4666.99%\nConvertibles\nEquities24'3190.12%\nEquities24'3190.12%\nEquity funds/certificates\nMixed funds\nStructured products6'946'23935.69%\nStructured products (Bonds)5'956'43930.60%\nStructured products (Equities)989'8005.09%\nVarious Certificates\nMetal accounts and precious metals\nMet  al   accounts\nPrecious metals\nReal Estate\nOther assets26'1290.13%\nHedge Funds & Private Equity26'1290.13%\nAlternative UCITS\nCommodity funds\nOptions\nLiabilities and obligationsCountervalue USD\nLiabilities\nCash accounts\nFixed advance\nProfit & loss\nFRA / IRS\nFutures\nFx Forwards\nTotal assets19'464'431100.00%\nPortfolio Total19'464'431\nTotal gain/loss of liabilities and obligations0\nPrint date 01.04.2025 // Page 2/17\n\nCurrency allocation\nMESSOS ENTERPRISES LTD.\nValuation as of 31.03.2025\nClient Number 366223\naeouiAEOUIaeouiAEOUI\nSwift CBLUCH2280A// Clearing 8490 // CHE-105.962.409IVA\nTel. +41 44 21810 20// Fax +41442181029// info@corner.ch // corner.ch\nCornèr Banca SA\n// Töd  istrasse 27 // Postfach 16  40 // 8027Zürich_Switzerland // Hauptsitz Via Canova 16,6901 Lugano_Switzerland\nAsset AllocationCountervalue USDWeightUSDCHF\nLiquidity103'7700.53%0.53%\nCash accounts6'0700.03%0.03%\nMoney Market97'7000.50%0.50%\nFixed deposits and fiduciaries\nBonds12'363'97463.52%63.52%\nBonds11'002'50856.53%56.53%\nBond funds / certificat  es1'  361'4666.99%6.99%\nConvertibles\nEquities24'3190.12%0.12%\nEquities24'3190.12%0.12%\nEquity funds/certificates\nMixed funds\nStructured products6'946'23935.69%35.69%\nStructured products (Bonds)5'956'43930.60%30.60%\nStructured products (Equities)989'8005.09%5.09%\nVarious Certificates\nMetal accounts and precious metals\nMet  al   accounts\nPrecious metals\nReal Estate\nOther assets26'1290.13%0.13%\nHedge Funds & Private Equity26'1290.13%0.13%\nAlternative UCITS\nCommodity funds\nOptions\nTotal assets19'464'431100.00%99.88%0.12%\nPrint date 01.04.2025 // Page 3/17\n\nPerformance Overview/Evolution\nMESSOS ENTERPRISES LTD.\nValuation as of 31.03.2025\nClient Number 366223\naeouiAEOUIaeouiAEOUI\nSwift CBLUCH2280A// Clearing 8490 // CHE-105.962.409IVA\nTel. +41 44 21810 20// Fax +41442181029// info@corner.ch // corner.ch\nCornèr Banca SA\n// Töd  istrasse 27 // Postfach 16  40 // 8027Zürich_Switzerland // Hauptsitz Via Canova 16,6901 Lugano_Switzerland\nin %USDEvaluation Period 01.01.2025 // 31.03.2025\n19'172'732Val  ue as of   31.12.2024\n19'464'431Value as of 31.03.2025\n0Inflows/Outflows\n0Money In\n0Money Out\n0Security In\n0Security Out\n1.52%291'700Performance TWR\n0.00%635Contribution of currencies\n1.52%291'065In Local Currency\n0.44%84'967Thereof Earnings\nPerformance 2024\n0.00%\n2.00%\n4.00%\n6.00%\n8.00%\n-2.00%\n01/202402/202403/202404/202405/202406/202407/202408/202409/202410/2024\n11/2024\n12/2024\n5.56%\nPerformance 2025\n0.00%\n2.00%\n4.00%\n6.00%\n8.00%\n-2.00%\n01/202502/202503/202504/202505/202506/202507/202508/202509/202510/2025\n11/2025\n12/2025\n1.52%\nPrint date 01.04.2025 // Page 4/17\n\nLiquidity and liabilities\nMESSOS ENTERPRISES LTD.\nValuation as of 31.03.2025\nClient Number 366223\naeouiAEOUIaeouiAEOUI\nSwift CBLUCH2280A// Clearing 8490 // CHE-105.962.409IVA\nTel. +41 44 21810 20// Fax +41442181029// info@corner.ch // corner.ch\nCornèr Banca SA\n// Töd  istrasse 27 // Postfach 16  40 // 8027Zürich_Switzerland // Hauptsitz Via Canova 16,6901 Lugano_Switzerland\nCurrency\nin %\nof assets\nPerf Total\nPerf Market\nPerf Currency\nValuation in price currency\nThereof accruals\nCountervalue USD\nActual Price\nActual Ex. Rate\nPrice Date\nAverage Acquisition price\nAverage Acquisition FX Rate\nDescriptionPerf YTD\nNominal/\nQuantity\nCash accounts credit\nUSD6'069.770.03%\nCash Accounts  //  366223-CC-0002\nIBAN: CH1908490000366223002\nPRC: 1.00\n6'070\nORDINARY USD\nMoney market\nUSD100'000.00\n-2.30%\n0.50%\nISIN: XS2993414619  //  Valorn.: 140610687\nMM secs discounted  //  Maturity: 28.03.2035  //  PRC: 5.00\n100.000097.700097'700\n-2.30%\n31.03.2025\nRBC LONDON 0% NOTES 2025-28.03.2035\nTotal Liquidity103'770USD0.53%\nthereof Cash accountsUSD6'0700.03%\nthereof Money m arketUSD97'7000.50%\nPrint date 01.04.2025 // Page 5/17\n\nBonds\nMESSOS ENTERPRISES LTD.\nValuation as of 31.03.2025\nClient Number 366223\naeouiAEOUIaeouiAEOUI\nSwift CBLUCH2280A// Clearing 8490 // CHE-105.962.409IVA\nTel. +41 44 21810 20// Fax +41442181029// info@corner.ch // corner.ch\nCornèr Banca SA\n// Töd  istrasse 27 // Postfach 16  40 // 8027Zürich_Switzerland // Hauptsitz Via Canova 16,6901 Lugano_Switzerland\nCurrency\nin %\nof assets\nPerf Total\nPerf Market\nPerf Currency\nValuation in price currency\nThereof accruals\nCountervalue USD\nActual Price\nActual Ex. Rate\nPrice Date\nAverage Acquisition price\nAverage Acquisition FX Rate\nDescriptionPerf YTD\nNominal/\nQuantity\nBonds, Bond funds, Convertible bonds, Interest options\nUSD200'000\n0.25%\n1.02%\nISIN: XS2530201644  //  Valorn.: 125350273\nOrdinary Bonds  //  Maturity: 23.02.2027\nCoupon: 23.5  //  Quarterly  3.32%  //  Days: 37\nMoody's: A2  //  PRC: 2.00\n100.200099.1991199'080\n-1.00%\n28.03.2025\n682\nTORONTO DOMINION BANK NOTES 23-23.02.27 REG-S VRN\nUSD200'000\n0.47%\n1.03%\nVRN\n100.200099.6285200'288\n-0.57%\n28.03.2025\n1'031\nCANADIAN IMPERIAL BANK OF COMMERCE NOTES 23-22.08.28\nISIN: XS2588105036  //  Valorn.: 112286204\nOrdinary Bonds  //  Maturity: 22.02.2028\nCoupon: 23.2  //  Annual  5.1531%  //  Days: 46\nPRC: 5.00\nUSD1'500'000\n1.49%\n7.75%\nSE.195\n99.099098.37001'507'550\n-0.74%\n31.03.2025\n32'000\nHARP ISSUER (4% MIN/5,5% MAX) NOTES 2023-18.09.2028\nISIN: XS2665592833  //  Valorn.: 128829182\nOrdinary Bonds  //  Maturity: 18.09.2028\nCoupon: 18.9  //  Annual  4%  //  Days: 192\nPRC: 5.00\nUSD690'000\n2.26%\n3.79%\nISIN: XS2692298537  //  Valorn.: 129157183\nOrdinary Bonds  //  Maturity: 07.11.2029\nYTM: -1.44  //  PRC: 5.00\n100.1000106.9200737'748\n6.81%\n31.03.2025\nGOLDMAN SACHS 0% NOTES 23-07.11.29 SERIES P\nUSD100'000\n1.16%\n0.50%\nISIN: XS2754416860  //  Valorn.: 132648671\nOrdinary Bonds  //  Maturity: 17.01.2030\nCoupon: 17.1  //  Annual  5.238%  //  Days: 73\nPRC: 5.00\n100.200097.140098'202\n-3.05%\n31.03.2025\n1'062\nLUMINIS (4.2 % MIN/5.5 % MAX) NOTES 2024-17.01.30\nUSD100'000\n2.24%\n0.53%\nISIN: XS2761230684  //  Valorn.: 112288215\nZero Bonds  //  Maturity: 13.02.2030\nCoupon: 13.2  //  Annual  2%  //  Days: 47  //  YTM: 6.89\nPRC: 5.00\n100.2000102.2448102'506\n2.04%\n28.03.2025\n261\nCIBC 0% NOTES 2024-13.02.2030 VARIABLE RATE\nUSD250'000\n-2.58%\n1.32%\nISIN: XS2736388732  //  Valorn.: 131799640\nOrdinary Bonds  //  Maturity: 20.12.2031\nDays: 265\nPRC: 5.00\n100.200099.2500256'958\n-0.95%\n31.03.2025\n8'833\nBANK OF AMERICA NOTES 2023-20.12.31 VARIABLE RATE\nPrint date 01.04.2025 // Page 6/17\n\nBonds\nMESSOS ENTERPRISES LTD.\nValuation as of 31.03.2025\nClient Number 366223\naeouiAEOUIaeouiAEOUI\nSwift CBLUCH2280A// Clearing 8490 // CHE-105.962.409IVA\nTel. +41 44 21810 20// Fax +41442181029// info@corner.ch // corner.ch\nCornèr Banca SA\n// Töd  istrasse 27 // Postfach 16  40 // 8027Zürich_Switzerland // Hauptsitz Via Canova 16,6901 Lugano_Switzerland\nCurrency\nin %\nof assets\nPerf Total\nPerf Market\nPerf Currency\nValuation in price currency\nThereof accruals\nCountervalue USD\nActual Price\nActual Ex. Rate\nPrice Date\nAverage Acquisition price\nAverage Acquisition FX Rate\nDescriptionPerf YTD\nNominal/\nQuantity\nBonds, Bond funds, Convertible bonds, Interest options\nUSD50'000\n1.07%\n0.25%\n09.05.34\n100.200097.334048'667\n-2.86%\n31.03.2025\nCITIGROUP GLBL 5.65 % CALL FIXED RATE NOTES 2024-\nISIN: XS2782869916  //  Valorn.: 132544344\nOrdinary Bonds  //  Maturity: 09.05.2034\nPRC: 5.00\nPrice to be verified\nUSD440'000\n1.81%\n2.46%\nISIN: XS2824054402  //  Valorn.: 135337661\nOrdinary Bonds  //  Callable: 29.05.2026\nCoupon: 29.5  //  Annual  5.6%  //  Days: 301  //  YTM: 5.04\nPRC: 5.00\n100.2000103.9900478'158\n3.78%\n31.03.2025\n20'602\nBOFA 5.  6% 2024-29.05.34 REGS\nUSD2'450'000\n1.26%\n13.21%\nISIN: XS2567543397  //  Valorn.: 134736192\nOrdinary Bonds  //  Callable: 18.06.2026\nCoupon: 18.6  //  Annual  5.61%  //  Days: 282  //  YTM: 5.53\nPRC: 5.00\n100.1000100.52002'570'405\n0.42%\n31.03.2025\n107'665\nGS 10Y CALLABLE NOTE 2024-18.06.2034\nUSD1'100'000\n1.50%\n5.66%\nISIN: XS2110079584  //  Valorn.: 136429245\nZero Bonds  //  Callable: 09.07.2026\nYTM: 5.88  //  PRC: 5.00\n100.1000100.10001'101'100\n0.00%\n31.03.2025\nCITIGROUP 0% MTN 2024-09.07.34 REGS\nUSD90'000\n2.35%\n0.46%\nGLOBAL RE\n100.2000100.060090'054\n-0.14%\n31.03.2025\nCITIGROUP GLBL 0 % MEDIUM TERM NOTES 2024-01.08.34\nISIN: XS2848820754  //  Valorn.: 135116008\nZero Bonds  //  Maturity: 01.08.2034\nPRC: 5.00\nUSD100'000\n1.16%\n0.47%\nISIN: XS2829712830  //  Valorn.: 134735316\nOrdinary Bonds  //  Maturity: 30.09.2034\nYTM: 5.64  //  PRC: 5.00\n99.999692.320092'320\n-7.68%\n31.03.2025\nGOLDMAN SACHS EMTN 2024-30.09.2024\nUSD200'000\n1.92%\n1.02%\nISIN: XS2912278723  //  Valorn.: 138689613\nZero Bonds  //  Maturity: 17.10.2034\nYTM: 4.82  //  PRC: 5.00\n100.200099.5654199'131\n-0.63%\n28.03.2025\nBANK OF AMERICA 0% NOTES 2024-17.10.2034\nUSD100'000\n1.09%\n0.49%\n37954\n100.200096.056996'057\n-4.13%\n31.03.2025\nJPMORGAN CHASE  0   % NOTES 2024-29.10.34 SERIES 2021-\nISIN: XS2381723902  //  Valorn.: 128883231\nZero Bonds  //  Maturity: 29.10.2034\nPRC: 5.00\nPrint date 01.04.2025 // Page 7/17\n\nBonds\nMESSOS ENTERPRISES LTD.\nValuation as of 31.03.2025\nClient Number 366223\naeouiAEOUIaeouiAEOUI\nSwift CBLUCH2280A// Clearing 8490 // CHE-105.962.409IVA\nTel. +41 44 21810 20// Fax +41442181029// info@corner.ch // corner.ch\nCornèr Banca SA\n// Töd  istrasse 27 // Postfach 16  40 // 8027Zürich_Switzerland // Hauptsitz Via Canova 16,6901 Lugano_Switzerland\nCurrency\nin %\nof assets\nPerf Total\nPerf Market\nPerf Currency\nValuation in price currency\nThereof accruals\nCountervalue USD\nActual Price\nActual Ex. Rate\nPrice Date\nAverage Acquisition price\nAverage Acquisition FX Rate\nDescriptionPerf YTD\nNominal/\nQuantity\nBonds, Bond funds, Convertible bonds, Interest options\nUSD250'000\n0.73%\n1.24%\n18.11.2034\n99.679096.8300242'075\n-2.86%\n27.03.2025\nGOLDMAN SACHS 0% EURO MEDIUM TERM NOTES 2024-\nISIN: XS2829752976  //  Valorn.: 138874416\nOrdinary Bonds  //  Maturity: 18.11.2034\nYTM: 5.65  //  PRC: 5.00\nUSD150'000\n1.90%\n0.75%\nISIN: XS2953741100  //  Valorn.: 138494467\nZero Bonds  //  Maturity: 11.12.2034\nYTM: 5.28  //  PRC: 5.00\n99.198097.7500146'625\n-1.46%\n27.03.2025\nBANK OF AMERICA 0 % NOTES 2024-11.12.34 REG S\nUSD500'000\n3.70%\n2.60%\nISIN: XS2381717250  //  Valorn.: 128883267\nZero Bonds  //  Maturity: 19.12.2034\nPRC: 5.00\n100.2000101.1000505'500\n0.90%\n31.03.2025\nJPMORGAN CHASE 0% NOTES 2024-19.12.2034\nUSD50'000\n-1.10%\n0.25%\nISIN: XS2481066111    //  Val  orn.: 126294402\nZero Bonds  //  Maturity: 03.02.2035\nYTM: 0.10  //  PRC: 5.00\n100.100099.000049'500\n-1.10%\n31.03.2025\nGOLDMAN SACHS 0% NOTES 2025-03.02.2035\nUSD1'470'000\n0.72%\n7.61%\nISIN: XS2964611052  //  Valorn.: 141235167\nZero Bonds  //  Maturity: 14.02.2035\nYTM: 5.41  //  PRC: 5.00\n100.0000100.72001'480'584\n0.72%\n31.03.2025\nDEUTSCHE BANK 0 % NOTES 2025-14.02.35\nUSD800'000\n0.00%\n4.11%\nREG S\n100.0000100.0000800'000\n0.00%\n28.03.2025\nWELLS FARGO 0 % EURO MEDIUM TERM NOTES 2025-28.03.36\nISIN: XS3035947103  //  Valorn.: 143578751\nOrdinary Bonds  //  Maturity: 28.03.2036\nPRC: 5.00\nUSD2'581.79\n0.00%\n0.59%\nSP\n81.530444.7800115'613\n-45.08%\n13.09.2024\nPREMIUM ALT.S.A. SICAV-SIF - COMMERCIAL FINANCE OPP.XB\nISIN: LU2228214107  //  Valorn.: 57282891\nBond Funds / Certificates\nPRC: 3.00\nUSD350'000\n1.14%\n1.76%\nVRN\n100.623797.6000342'643\n-3.00%\n31.03.2025\n1'043\nBK JULIUS BAER CAP.PROT.(3,25% MIN.4,5% MAX)23-26.05.28\nISIN: CH1269060229  //  Valorn.: 126906022\nStructured Bonds  //  Maturity: 26.05.2028\nCoupon: 26.5  //  Quarterly  3.25%  //  Days: 33\nPRC: 3.00\nPrice to be verified\nPrint date 01.04.2025 // Page 8/17\n\nBonds\nMESSOS ENTERPRISES LTD.\nValuation as of 31.03.2025\nClient Number 366223\naeouiAEOUIaeouiAEOUI\nSwift CBLUCH2280A// Clearing 8490 // CHE-105.962.409IVA\nTel. +41 44 21810 20// Fax +41442181029// info@corner.ch // corner.ch\nCornèr Banca SA\n// Töd  istrasse 27 // Postfach 16  40 // 8027Zürich_Switzerland // Hauptsitz Via Canova 16,6901 Lugano_Switzerland\nCurrency\nin %\nof assets\nPerf Total\nPerf Market\nPerf Currency\nValuation in price currency\nThereof accruals\nCountervalue USD\nActual Price\nActual Ex. Rate\nPrice Date\nAverage Acquisition price\nAverage Acquisition FX Rate\nDescriptionPerf YTD\nNominal/\nQuantity\nBonds, Bond funds, Convertible bonds, Interest options\nUSD690'000\n1.54%\n3.65%\nISIN: XS0461497009  //  Valorn.: 130269069\nOrdinary Bonds  //  Maturity: 08.11.2028\nCoupon: 8.11  //  Annual  5.5%  //  Days: 142\nPRC: 5.00\n100.1000100.8900711'110\n0.79%\n31.03.2025\n14'969\nDEUTSCHE BANK NOTES 23-08.11.28 VRN\nUSD140'000\n3.10%\n0.99%\nISIN: XS2746319610  //  Valorn.: 133393503\nOrdinary Bonds  //  Maturity: 01.03.2030\nCoupon: Annual  32.46%  //  Days: 385  //  YTM: 16.79\nPRC: 5.00\n100.2000102.5000192'100\n2.30%\n31.03.2025\n48'600\nSOCIETE GENERALE 32.46 % NOTES 2024-01.03.30 REG S\nTotal Bonds\nAccrued interest\n12'363'974USD\nUSD236'748\n63.52%\nthereof B ondsUSD11'002'50856.53%\nthereof B ond funds /  c ertficatesUSD1'361'4666.99%\nPrint date 01.04.2025 // Page 9/17\n\nEquities\nMESSOS ENTERPRISES LTD.\nValuation as of 31.03.2025\nClient Number 366223\naeouiAEOUIaeouiAEOUI\nSwift CBLUCH2280A// Clearing 8490 // CHE-105.962.409IVA\nTel. +41 44 21810 20// Fax +41442181029// info@corner.ch // corner.ch\nCornèr Banca SA\n// Töd  istrasse 27 // Postfach 16  40 // 8027Zürich_Switzerland // Hauptsitz Via Canova 16,6901 Lugano_Switzerland\nCurrency\nin %\nof assets\nPerf Total\nPerf Market\nPerf Currency\nValuation in price currency\nThereof accruals\nCountervalue USD\nActual Price\nActual Ex. Rate\nPrice Date\nAverage Acquisition price\nAverage Acquisition FX Rate\nDescriptionPerf YTD\nNominal/\nQuantity\nEquities, Equity funds, Options on equities/indices\nCHF800\n-3.10%\n0.12%\nISIN: CH0244767585  //  Valorn.: 24476758\nOrdinary Stocks  //  PRC: 3.91\n221.564126.870021'496\n1.13401.1313\n-87.90%\n-0.24%\n31.03.202524'319\nUBS GROUP INC NAMEN-AKT.\n-87.87%\nTotal Equities24'319USD0.12%\nthereof E quities (without options)USD24'3190.12%\nPrint date 01.04.2025 // Page 10/17\n\nStructured products\nMESSOS ENTERPRISES LTD.\nValuation as of 31.03.2025\nClient Number 366223\naeouiAEOUIaeouiAEOUI\nSwift CBLUCH2280A// Clearing 8490 // CHE-105.962.409IVA\nTel. +41 44 21810 20// Fax +41442181029// info@corner.ch // corner.ch\nCornèr Banca SA\n// Töd  istrasse 27 // Postfach 16  40 // 8027Zürich_Switzerland // Hauptsitz Via Canova 16,6901 Lugano_Switzerland\nCurrency\nin %\nof assets\nPerf Total\nPerf Market\nPerf Currency\nValuation in price currency\nThereof accruals\nCountervalue USD\nActual Price\nActual Ex. Rate\nPrice Date\nAverage Acquisition price\nAverage Acquisition FX Rate\nDescriptionPerf YTD\nNominal/\nQuantity\nStructured products (Bonds)\nUSD200'000\n-2.01%\n1.01%\nCITD    26\n100.728897.9853196'221\n-2.72%\n28.02.2025\n250\nBCO SAFRA CAYMAN 5% STRUCT.NOTE 2022-21.06.27 3,4%\nISIN: XS2519369867  //  Valorn.: 121050656\nOther convertible bonds  //  Maturity: 21.06.2027\nDays: 9  //  PRC: 5.00\nUSD500'000\n0.22%\n2.58%\nISIN: XS2315191069  //  Valorn.: 111918998\nStructured Bonds  //  Maturity: 08.01.2029\nDays: 82  //  PRC: 5.0 0\nPrice to be verified\n100.524199.0000502'305\n-1.52%\n31.03.2025\n7'305\nBNP PARIBAS ISS STRUCT.NOTE 21-08.01.29 ON DBDK 29 631\nUSD1'200'000\n-1.83%\n5.93%\nISIN: XS2792098779  //  Valorn.: 140288136\nStructured Bonds  //  Maturity: 02.12.2034  //  PRC: 5.00\nPrice to be verified\n100.000096.19301'154'316\n-3.81%\n31.03.2025\nCITIGROUP\nUSD690'000\n-1.94%\n3.62%\nWELLS F.\n100.446299.0900704'064\n-1.35%\n27.03.2025\n20'343\nEMERALD BAY NOTES 23-17.09.29 S.2023-05 REG-S VRN\nISIN: XS2714429128  //  Valorn.: 130738882\nStructured Bonds  //  Maturity: 17.09.2029\nDays: 195  //  PRC: 5.00\nPrice to be verified\nUSD500'000\n-0.21%\n2.49%\n34\n100.524396.7400484'457\n-3.76%\n31.03.2025\n757\nGOLDMAN SACHS GR.STRUCT.NOTE 21-20.12.28 VRN ON NAT\nISIN: XS2105981117  //  Val  orn.: 114118068\nStructured Bonds  //  Maturity: 20.12.2028\nDays: 10  //  PRC: 4.0 0\nPrice to be verified\nUSD1'600'000\n0.35%\n8.34%\nISIN: XS2838389430  //  Valorn.: 135968317\nStructured Bonds  //  Maturity: 26.04.2033\nDays: 279  //  PRC: 5.00\nPrice to be verified\n100.100097.08001'623'960\n-3.02%\n31.03.2025\n70'680\nLUMINIS 5.7% STR NOTE 2024-26.04.33 WFC 24W\nUSD500'000\n0.28%\n2.51%\nRABOBANK 29\n98.018197.4900488'866\n-0.54%\n31.03.2025\n1'416\nLUMINIS REPACK NOTES 23-25.05.29 VRN ON 4,625%\nISIN: XS2631782468  //  Valorn.: 127708275\nStructured Bonds  //  Maturity: 25.05.2029\nDays: 19  //  PRC: 5.0 0\nPrice to be verified\nUnderlying:FED RES BK SOFR US\nPrint date 01.04.2025 // Page 11/17\n\nStructured products\nMESSOS ENTERPRISES LTD.\nValuation as of 31.03.2025\nClient Number 366223\naeouiAEOUIaeouiAEOUI\nSwift CBLUCH2280A// Clearing 8490 // CHE-105.962.409IVA\nTel. +41 44 21810 20// Fax +41442181029// info@corner.ch // corner.ch\nCornèr Banca SA\n// Töd  istrasse 27 // Postfach 16  40 // 8027Zürich_Switzerland // Hauptsitz Via Canova 16,6901 Lugano_Switzerland\nCurrency\nin %\nof assets\nPerf Total\nPerf Market\nPerf Currency\nValuation in price currency\nThereof accruals\nCountervalue USD\nActual Price\nActual Ex. Rate\nPrice Date\nAverage Acquisition price\nAverage Acquisition FX Rate\nDescriptionPerf YTD\nNominal/\nQuantity\nStructured products (Bonds)\nUSD100'000\n-0.07%\n0.51%\nSRN\n91.021798.671998'672\n8.40%\n31.03.2025\nNATIXIS STRUC.NOTES 19-20.6.26 VRN ON 4,75%METLIFE 21\nISIN: XS1700087403  //  Valorn.: 39877135\nStructured Bonds  //  Maturity: 20.06.2026  //  PRC: 5.00\nPrice to be verified\nUSD200'000\n-1.90%\n0.99%\nISIN: XS2594173093  //  Valorn.: 125443809\nStructured Bonds  //  Maturity: 27.09.2029\nDays: 33  //  PRC: 5.0 0\nPrice to be verified\n99.059296.2100193'464\n-2.88%\n31.03.2025\n1'044\nNOVUS CAPITAL CREDIT LINKED NOTES 2023-27.09.2029\nUSD500'000\n4.36%\n2.62%\nNATWEST GROUP\n100.5243100.7200510'114\n0.19%\n31.03.2025\n6'514\nNOVUS CAPITAL STRUCT.NOTE 2021-12.01.28 VRN ON\nISIN: XS2407295554  //  Valorn.: 114718568\nStructured Bonds  //  Maturity: 12.01.2028\nDays: 78  //  PRC: 5.0 0\nPrice to be verified\nStructured products (Equities)\nUSD1'000'000\n0.60%\n5.09%\nGROUP\n100.366498.9800989'800\n-1.38%\n28.03.2025\nNOVUS CAPITAL STRUCTURED NOTES 20-15.05.26 ON CS\nISIN: XS2252299883  //  Valorn.: 58001077\nStructured products equity  //  Maturity: 15.05.2026  //  PRC: 5.00\nPrice to be verified\nUnderlying:INTERBK LIBOR 3 MTH\nTotal Structured products\nAccrued interest\n6'946'239USD\nUSD108'309\n35.69%\nthereof S tructured products (Bonds)USD5'956'43930.60%\nthereof S tructured products (Equities)USD989'8005.09%\nPrint date 01.04.2025 // Page 12/17\n\nOther assets\nMESSOS ENTERPRISES LTD.\nValuation as of 31.03.2025\nClient Number 366223\naeouiAEOUIaeouiAEOUI\nSwift CBLUCH2280A// Clearing 8490 // CHE-105.962.409IVA\nTel. +41 44 21810 20// Fax +41442181029// info@corner.ch // corner.ch\nCornèr Banca SA\n// Töd  istrasse 27 // Postfach 16  40 // 8027Zürich_Switzerland // Hauptsitz Via Canova 16,6901 Lugano_Switzerland\nCurrency\nin %\nof assets\nPerf Total\nPerf Market\nPerf Currency\nValuation in price currency\nThereof accruals\nCountervalue USD\nActual Price\nActual Ex. Rate\nPrice Date\nAverage Acquisition price\nAverage Acquisition FX Rate\nDescriptionPerf YTD\nNominal/\nQuantity\nHedge Funds & Private Equity\nUSD204.071\n0.00%\n0.13%\nR\n1'008.3748128.039526'129\n-87.30%\n31.12.2023\nEXIGENT ENHANCED INCOME FUND LTD SHS A SERIES 2019 1\nISIN: XD0466760473  //  Valorn.: 46676047\nHedge Funds & Private Equity  //  PRC: 5.00\nPrice to be verified\nTotal Other assets26'129USD0.13%\nthereof Hedge funds &  P rivate EquityUSD26'1290.13%\nPrint date 01.04.2025 // Page 13/17\n\nExpected Cash Flows (Overview)\nMESSOS ENTERPRISES LTD.\nValuation as of 31.03.2025\nClient Number 366223\naeouiAEOUIaeouiAEOUI\nSwift CBLUCH2280A// Clearing 8490 // CHE-105.962.409IVA\nTel. +41 44 21810 20// Fax +41442181029// info@corner.ch // corner.ch\nCornèr Banca SA\n// Töd  istrasse 27 // Postfach 16  40 // 8027Zürich_Switzerland // Hauptsitz Via Canova 16,6901 Lugano_Switzerland\nNext 12 months\nAt sight04 202505 202506 202507 202508 202509 202510 202511 202512 202501 202602 202603 2026\nUSD6'07092'80131'960146'761100'57937'9502'5005'31112'3062'500\nTotal USD6'07092'80131'960146'761100'57937'9502'5005'31112'3062'500\nNext years\nWeight in %Total in currency20252026202720282029Others\nUSD100.00%16'878'474412'551280'902460'2852'995'2852'135'28510'594'166\nTotal USD100.00%16'878'474412'551280'902460'2852'995'2852'135'28510'594'166\nPrint date 01.04.2025 // Page 14/17\n\nGlossary\nMESSOS ENTERPRISES LTD.\nValuation as of 31.03.2025\nClient Number 366223\naeouiAEOUIaeouiAEOUI\nSwift CBLUCH2280A// Clearing 8490 // CHE-105.962.409IVA\nTel. +41 44 21810 20// Fax +41442181029// info@corner.ch // corner.ch\nCornèr Banca SA\n// Töd  istrasse 27 // Postfach 16  40 // 8027Zürich_Switzerland // Hauptsitz Via Canova 16,6901 Lugano_Switzerland\nLiquidity\nLiquidity consists of assets deposited in current accounts, as well as time deposits, fiduciary and money market investments. \nMoney market products are normally loans in the form of securities or book-entry rights issued for short-term financing purposes, particularly with a \nmaturity of one year or less.\nBonds\nThis segment consists of investments in bonds. Ordinary bonds consist of fixed-maturity third-party capital, yielding fixed interest payments by the issuer \n(obligor) at periodic intervals. In most cases, the bonds are redeemed at maturity.    \nIn addition to conventional type bonds, this category also includes: convertible bonds with a right to subscribe for shares or hybrid bonds, bond funds and  \ntracker certificates on bonds.\nMoreover, this category includes derivatives (options and futures) with   underlying bonds. The underlying bonds are not counted in the tot  al   of the \ncategory.\nEquities\nThis category includes equities, profit-sharing certificates, dividend-right certificates, and equity funds and tracker certificates on equities. Moreover, this \ncategory includes derivatives (options and futures) with underlying equities. The underlying equities are not counted in the total of the category.\nMixed Funds\nThis category includes strategic funds that invest across a variety of asset classes, such as equities, bonds or real estate. Strategic funds, which are \nused to implement predetermined investment strategies, are often also referred to as asset allocation funds or mixed funds.\nStructured Products\nThis category includes structured products sold by an issuer in public offerings or privately. Their redemption value depends on the performance of one \nor more underlyings. The underlyings that may be used for structured products include investment instruments such as equities, interest rates, indexes, \nforeign currencies or commodities.\nAccording to the model of the SSPA (Swiss Structured Products Association), the most widespread categories include the following product groups: \ncapital protection products, yield enhancement products, participation products (tracker certificates on equities and bonds are included in the category of \nthe underlying in this valuation), leverage products and investment products with additional credit risk\nMetal accounts and precious metals\nThis category includes the most commonly traded precious metals such as gold, silver, platinum and palladium. Investments in precious metals may be \nmade directly (by purchasing the physical metal) or holding a metal ac  count.\nReal Estate\nThis category includes real estate funds that typically invest in income-earning properties such as multifamily homes or business establishments.\nOther assets\nThis category includes: alternative funds (offshore funds and hedge funds), private equity (investments in venture capital financing, primarily for unlisted \nenterprises), funds that invest in commodities (e.g. mining products) or in physical assets (such as agricultural produce), forex investments.\nPrint date 01.04.2025 // Page 15/17\n\nGlossary\nMESSOS ENTERPRISES LTD.\nValuation as of 31.03.2025\nClient Number 366223\naeouiAEOUIaeouiAEOUI\nSwift CBLUCH2280A// Clearing 8490 // CHE-105.962.409IVA\nTel. +41 44 21810 20// Fax +41442181029// info@corner.ch // corner.ch\nCornèr Banca SA\n// Töd  istrasse 27 // Postfach 16  40 // 8027Zürich_Switzerland // Hauptsitz Via Canova 16,6901 Lugano_Switzerland\nProduct Risk Classifier (PRC)\nThe PRC (Product Risk Classifier) is a risk indicator, provided by third parties, which is based on quantitative models. This provides an indication of the financial risk of the individual investment products \nand therefore allows comparing the financial risk of financial instruments belonging to various asset categories and classes. \nThis value is calcul  at  ed by taking int  o consideration the three basis aspects of an investment product’s financial risk: the market risk, credit risk and liquidity risk.\nThe Portfolio Risk Classifer (PRC) is measured on a scale that goes from 1 (very low risk) to 5 (very high risk).\nPerformance\nPerformance is the percentage trend in asset value and therefore expresses the return on a securities portfolio over a given period of time. The performance indicator is expressed as “Total Return”. In \nfact, the calculation takes not only price gains/losses into account but also interest (including pro rata interest) and dividend payments. \nThe Bank calculates performance using the TWR (Time-Wei  ghted Return) calculation method, which measures the compound rate of return on a portfolio, eliminating the impact of any cash flows made \nby the investor (deposits or withdrawals).   \nPerformance is stated net, i.e. performance net of taxes and of transaction and management   fees.\nThe asset valuation reports the information available at the time of preparation of the asset valuation for the relevant valuation date.\nPrint date 01.04.2025 // Page 16/17\n\nNotices and other information\nMESSOS ENTERPRISES LTD.\nValuation as of 31.03.2025\nClient Number 366223\naeouiAEOUIaeouiAEOUI\nSwift CBLUCH2280A// Clearing 8490 // CHE-105.962.409IVA\nTel. +41 44 21810 20// Fax +41442181029// info@corner.ch // corner.ch\nCornèr Banca SA\n// Töd  istrasse 27 // Postfach 16  40 // 8027Zürich_Switzerland // Hauptsitz Via Canova 16,6901 Lugano_Switzerland\nValuations and prices\nThe present valuation is for informat  ion purposes only. The valuation of the asset  s in thi  s stat  ement is based on the prices and exchange rates derived from commonly used information sources in the \nbanking sector that the Bank considers to be reliable.\nThe stated prices and exchange rates   are merely indicat  ive and by no means binding on the Bank; they do not necessarily reflect the amounts actually attainable through market trading. Positions \nmarked \"price to be verified\" refer to instruments that are illiquid or for which no price and/or updated price can be obtained from an official source. \nThe data set forth in the asset valuation - even if they refer to the same valuation date but are generated at different times - may differ from one another due to transactions and/or adjustments, \nparticularly value adjustments, that have been recorded in the meantime with a retroactive effect or value date.\nThe Bank in no way guarantees the accuracy or completeness of the present valuation, the information contained herewith or the calcul  at  ions related to   the asset  s held in   custody.   \nThe Bank disclaims all liability for any loss or damage connected with use of the valuation and related information.\nThis document is neither designed nor suitable for tax   purposes.\nAny discrepancies or objections shall be reported to the Bank in writing within 30 days. Otherwise, the contents of this document will be deemed accepted.\nExcluded  information\nThe present asset valuation does not include liabilities from bills of exchange, acceptances and deeds of pledge, documentary credits, trust loans, sureties, guarantees, other forms of contingent liabilities \nor outstanding transactions.\nYour financial advisor will be happy to answer any questions you may have about the terms and positions set forth in the present statement.\nPrint date 01.04.2025 // Page 17/17",
    "pages": 19,
    "fileSize": 627670,
    "processingTime": 398,
    "metadata": {
      "info": {
        "PDFFormatVersion": "1.3",
        "IsAcroFormPresent": false,
        "IsXFAPresent": false
      },
      "version": "1.10.100"
    }
  },
  "extractedData": {
    "securities": [
      {
        "isin": "CH1908490000",
        "potentialValue": "31.03"
      },
      {
        "isin": "XS2993414619",
        "potentialValue": "105.96"
      },
      {
        "isin": "XS2530201644",
        "potentialValue": "2.40"
      },
      {
        "isin": "XS2588105036",
        "potentialValue": "31.03"
      },
      {
        "isin": "XS2665592833",
        "potentialValue": "01.04"
      },
      {
        "isin": "XS2692298537",
        "potentialValue": "105.96"
      },
      {
        "isin": "XS2754416860",
        "potentialValue": "2.40"
      },
      {
        "isin": "XS2761230684",
        "potentialValue": "31.03"
      },
      {
        "isin": "XS2736388732",
        "potentialValue": "105.96"
      },
      {
        "isin": "XS2782869916",
        "potentialValue": "2.40"
      },
      {
        "isin": "XS2824054402",
        "potentialValue": "7700.53"
      },
      {
        "isin": "XS2567543397",
        "potentialValue": "97463.52"
      },
      {
        "isin": "XS2110079584",
        "potentialValue": "3190.12"
      },
      {
        "isin": "XS2848820754",
        "potentialValue": "23935.69"
      },
      {
        "isin": "XS2829712830",
        "potentialValue": "1290.13"
      },
      {
        "isin": "XS2912278723",
        "potentialValue": "431100.00"
      },
      {
        "isin": "XS2381723902",
        "potentialValue": "11299.88"
      },
      {
        "isin": "XS2829752976",
        "potentialValue": "4961.13"
      },
      {
        "isin": "XS2953741100",
        "potentialValue": "130.88"
      },
      {
        "isin": "XS2381717250",
        "potentialValue": "3190.12"
      },
      {
        "isin": "XS2481066111",
        "potentialValue": "431100.00"
      },
      {
        "isin": "XS2964611052",
        "potentialValue": "01.04"
      },
      {
        "isin": "XS3035947103",
        "potentialValue": "31.03"
      },
      {
        "isin": "LU2228214107",
        "potentialValue": "105.96"
      },
      {
        "isin": "CH1269060229",
        "potentialValue": "2.40"
      },
      {
        "isin": "XS0461497009",
        "potentialValue": "7700.53"
      },
      {
        "isin": "XS2746319610",
        "potentialValue": "0700.03"
      },
      {
        "isin": "CH0244767585",
        "potentialValue": "7000.50"
      },
      {
        "isin": "XS2519369867",
        "potentialValue": "97463.52"
      },
      {
        "isin": "XS2315191069",
        "potentialValue": "50856.53"
      },
      {
        "isin": "XS2792098779",
        "potentialValue": "4666.99"
      },
      {
        "isin": "XS2714429128",
        "potentialValue": "3190.12"
      },
      {
        "isin": "XS2105981117",
        "potentialValue": "3190.12"
      },
      {
        "isin": "XS2838389430",
        "potentialValue": "23935.69"
      },
      {
        "isin": "XS2631782468",
        "potentialValue": "43930.60"
      },
      {
        "isin": "XS1700087403",
        "potentialValue": "8005.09"
      },
      {
        "isin": "XS2594173093",
        "potentialValue": "1290.13"
      },
      {
        "isin": "XS2407295554",
        "potentialValue": "1290.13"
      },
      {
        "isin": "XS2252299883",
        "potentialValue": "431100.00"
      },
      {
        "isin": "XD0466760473",
        "potentialValue": "01.04"
      }
    ],
    "totalValue": null,
    "date": "31.03.2025",
    "currency": "USD"
  },
  "timestamp": "2025-07-20T19:38:55.190Z"
}